{
  "name": "my-test-mcp-2",
  "description": "test2",
  "version": "1.0.0",
  "company": "test",
  "status": "active",
  "lifecycle": "development",
  "owner": "tamami",
  "authMethod": "none",
  "contactEmail": "test@test.com",
  "endpointUrl": "",
  "documentationUrl": "",
  "tags": [],
  "customProperties": {}
}